{
  "schema_version": 1,
  "gtin": "08906064284818",
  "barcode_printed": "8906064284818",
  "barcode_format": "EAN-13",
  "name": "GOODINI Celebration GIFT OF GOOD TASTE DALIOS PIST",
  "countries": [
    "IN"
  ],
  "package": {
    "quantity": {
      "value": 300,
      "unit": "g"
    }
  },
  "ingredients_raw": "Wheat Flour, Vegetable Shortening [Palm Oil, Palm Kernel, Sesame Oil Antioxidant E319)] Sugar, Invert Sugar Syrup, Corn Flour, Pistachio Nuts 2%, Salt, Emulsifier (Soya Lecithin), Raising Agent (Sodium Bicarbonate), Flavouring. Allergy Advice:",
  "sources": [
    {
      "id": "s1",
      "type": "open_database",
      "url": "https://world.openfoodfacts.org/product/8906064284818",
      "retrieved_at": "2026-09-01",
      "licence": "ODbL-1.0 (database), DbCL-1.0 (contents)"
    }
  ],
  "provenance": {
    "name": {
      "source": "s1",
      "confidence": "medium"
    },
    "package": {
      "source": "s1",
      "confidence": "medium"
    },
    "ingredients_raw": {
      "source": "s1",
      "confidence": "medium"
    }
  },
  "verification": {
    "status": "unverified",
    "last_verified": "2026-09-01"
  }
}
