{
  "schema_version": 1,
  "gtin": "08906010910389",
  "barcode_printed": "8906010910389",
  "barcode_format": "EAN-13",
  "name": "Dairy day mini cone magic",
  "brand": "dairy-day",
  "countries": [
    "IN"
  ],
  "package": {
    "quantity": {
      "value": 35,
      "unit": "g"
    }
  },
  "sources": [
    {
      "id": "s1",
      "type": "open_database",
      "url": "https://world.openfoodfacts.org/product/8906010910389",
      "retrieved_at": "2026-08-27",
      "licence": "ODbL-1.0 (database), DbCL-1.0 (contents)"
    }
  ],
  "provenance": {
    "name": {
      "source": "s1",
      "confidence": "medium"
    },
    "brand": {
      "source": "s1",
      "confidence": "medium"
    },
    "package": {
      "source": "s1",
      "confidence": "medium"
    }
  },
  "verification": {
    "status": "unverified",
    "last_verified": "2026-08-27"
  }
}
