{
  "schema_version": 1,
  "gtin": "08901023007903",
  "barcode_printed": "8901023007903",
  "barcode_format": "EAN-13",
  "name": "Mfg. Date please see on the side.",
  "countries": [
    "IN"
  ],
  "sources": [
    {
      "id": "s1",
      "type": "open_database",
      "url": "https://world.openfoodfacts.org/product/8901023007903",
      "retrieved_at": "2026-09-01",
      "licence": "ODbL-1.0 (database), DbCL-1.0 (contents)"
    }
  ],
  "provenance": {
    "name": {
      "source": "s1",
      "confidence": "medium"
    }
  },
  "verification": {
    "status": "unverified",
    "last_verified": "2026-09-01"
  }
}
