{
  "schema_version": 1,
  "gtin": "08906070215349",
  "barcode_printed": "8906070215349",
  "barcode_format": "EAN-13",
  "name": "Honey",
  "category": "honey",
  "countries": [
    "IN"
  ],
  "nutrition": [
    {
      "basis": "per_100g",
      "values": {
        "sugars_g": 0,
        "saturated_fat_g": 0
      }
    }
  ],
  "sources": [
    {
      "id": "s1",
      "type": "open_database",
      "url": "https://world.openfoodfacts.org/product/8906070215349",
      "retrieved_at": "2026-08-27",
      "licence": "ODbL-1.0 (database), DbCL-1.0 (contents)"
    }
  ],
  "provenance": {
    "name": {
      "source": "s1",
      "confidence": "medium"
    },
    "category": {
      "source": "s1",
      "confidence": "medium"
    },
    "nutrition": {
      "source": "s1",
      "confidence": "medium"
    }
  },
  "verification": {
    "status": "unverified",
    "last_verified": "2026-08-27"
  }
}
