{
  "schema_version": 1,
  "gtin": "08906064701964",
  "barcode_printed": "8906064701964",
  "barcode_format": "EAN-13",
  "name": "Palak murukku",
  "countries": [
    "IN"
  ],
  "nutrition": [
    {
      "basis": "per_100g",
      "values": {
        "energy_kcal": 478.57,
        "protein_g": 10.71,
        "carbohydrate_g": 64.29,
        "sugars_g": 1.07,
        "fat_g": 17.86,
        "saturated_fat_g": 10.71,
        "fibre_g": 7.14,
        "sodium_mg": 1314.29
      }
    }
  ],
  "sources": [
    {
      "id": "s1",
      "type": "open_database",
      "url": "https://world.openfoodfacts.org/product/8906064701964",
      "retrieved_at": "2026-09-01",
      "licence": "ODbL-1.0 (database), DbCL-1.0 (contents)"
    }
  ],
  "provenance": {
    "name": {
      "source": "s1",
      "confidence": "medium"
    },
    "nutrition": {
      "source": "s1",
      "confidence": "medium"
    }
  },
  "verification": {
    "status": "unverified",
    "last_verified": "2026-09-01"
  }
}
