{
  "schema_version": 1,
  "gtin": "08904063220370",
  "barcode_printed": "8904063220370",
  "barcode_format": "EAN-13",
  "name": "Chilli Gobhi Wrap",
  "brand": "haldiram-s",
  "countries": [
    "IN"
  ],
  "package": {
    "quantity": {
      "value": 156,
      "unit": "g"
    }
  },
  "nutrition": [
    {
      "basis": "per_serving",
      "serving": {
        "description": "1 pack (156 g)",
        "quantity": {
          "value": 156,
          "unit": "g"
        }
      },
      "values": {
        "energy_kcal": 145,
        "protein_g": 3,
        "carbohydrate_g": 23,
        "sugars_g": 7,
        "fat_g": 6,
        "saturated_fat_g": 3,
        "trans_fat_g": 1,
        "fibre_g": 1.6,
        "sodium_mg": 889
      }
    }
  ],
  "sources": [
    {
      "id": "s1",
      "type": "open_database",
      "url": "https://world.openfoodfacts.org/product/8904063220370",
      "retrieved_at": "2026-08-27",
      "licence": "ODbL-1.0 (database), DbCL-1.0 (contents)"
    }
  ],
  "provenance": {
    "name": {
      "source": "s1",
      "confidence": "medium"
    },
    "brand": {
      "source": "s1",
      "confidence": "medium"
    },
    "package": {
      "source": "s1",
      "confidence": "medium"
    },
    "nutrition": {
      "source": "s1",
      "confidence": "medium"
    }
  },
  "verification": {
    "status": "unverified",
    "last_verified": "2026-08-27"
  }
}
