{
  "schema_version": 1,
  "gtin": "08904004403732",
  "barcode_printed": "8904004403732",
  "barcode_format": "EAN-13",
  "name": "Haldiram moong dal",
  "brand": "haldiram",
  "category": "pulses",
  "countries": [
    "IN"
  ],
  "package": {
    "quantity": {
      "value": 200,
      "unit": "g"
    }
  },
  "nutrition": [
    {
      "basis": "per_100g",
      "values": {
        "energy_kcal": 476,
        "protein_g": 21.31,
        "carbohydrate_g": 50.66,
        "sugars_g": 0,
        "fat_g": 20.93,
        "saturated_fat_g": 5.64,
        "fibre_g": 7.52,
        "sodium_mg": 390
      }
    }
  ],
  "ingredients_raw": "Split Pulse Moong (Moong Dal) (77%), Refined Cotton Seed Oil & lodised Salt.",
  "sources": [
    {
      "id": "s1",
      "type": "open_database",
      "url": "https://world.openfoodfacts.org/product/8904004403732",
      "retrieved_at": "2026-08-27",
      "licence": "ODbL-1.0 (database), DbCL-1.0 (contents)"
    }
  ],
  "provenance": {
    "name": {
      "source": "s1",
      "confidence": "medium"
    },
    "brand": {
      "source": "s1",
      "confidence": "medium"
    },
    "category": {
      "source": "s1",
      "confidence": "medium"
    },
    "package": {
      "source": "s1",
      "confidence": "medium"
    },
    "nutrition": {
      "source": "s1",
      "confidence": "medium"
    },
    "ingredients_raw": {
      "source": "s1",
      "confidence": "medium"
    }
  },
  "verification": {
    "status": "unverified",
    "last_verified": "2026-08-27"
  }
}
