{
  "schema_version": 1,
  "gtin": "06942836717858",
  "barcode_printed": "6942836717858",
  "barcode_format": "EAN-13",
  "name": "Whole Almonds Chocolate",
  "brand": "hershey-s",
  "category": "chocolate",
  "countries": [
    "IN"
  ],
  "sources": [
    {
      "id": "s1",
      "type": "open_database",
      "url": "https://world.openfoodfacts.org/product/6942836717858",
      "retrieved_at": "2026-08-27",
      "licence": "ODbL-1.0 (database), DbCL-1.0 (contents)"
    }
  ],
  "provenance": {
    "name": {
      "source": "s1",
      "confidence": "medium"
    },
    "brand": {
      "source": "s1",
      "confidence": "medium"
    },
    "category": {
      "source": "s1",
      "confidence": "medium"
    }
  },
  "verification": {
    "status": "unverified",
    "last_verified": "2026-08-27"
  }
}
