{
  "schema_version": 1,
  "gtin": "08906010912864",
  "barcode_printed": "8906010912864",
  "barcode_format": "EAN-13",
  "name": "Tripple Bar Black Current",
  "brand": "dairy-day",
  "countries": [
    "IN"
  ],
  "nutrition": [
    {
      "basis": "per_100g",
      "values": {
        "energy_kcal": 361,
        "protein_g": 5,
        "carbohydrate_g": 32.6,
        "fat_g": 23.4
      }
    }
  ],
  "sources": [
    {
      "id": "s1",
      "type": "open_database",
      "url": "https://world.openfoodfacts.org/product/8906010912864",
      "retrieved_at": "2026-09-01",
      "licence": "ODbL-1.0 (database), DbCL-1.0 (contents)"
    }
  ],
  "provenance": {
    "name": {
      "source": "s1",
      "confidence": "medium"
    },
    "brand": {
      "source": "s1",
      "confidence": "medium"
    },
    "nutrition": {
      "source": "s1",
      "confidence": "medium"
    }
  },
  "verification": {
    "status": "unverified",
    "last_verified": "2026-09-01"
  }
}
