{
  "schema_version": 1,
  "gtin": "08904002500631",
  "barcode_printed": "8904002500631",
  "barcode_format": "EAN-13",
  "name": "MASQATI SITAPHAL ICECREAM",
  "brand": "masqati",
  "category": "ice-cream",
  "countries": [
    "IN"
  ],
  "package": {
    "quantity": {
      "value": 500,
      "unit": "ml"
    }
  },
  "sources": [
    {
      "id": "s1",
      "type": "open_database",
      "url": "https://world.openfoodfacts.org/product/8904002500631",
      "retrieved_at": "2026-08-27",
      "licence": "ODbL-1.0 (database), DbCL-1.0 (contents)"
    }
  ],
  "provenance": {
    "name": {
      "source": "s1",
      "confidence": "medium"
    },
    "brand": {
      "source": "s1",
      "confidence": "medium"
    },
    "category": {
      "source": "s1",
      "confidence": "medium"
    },
    "package": {
      "source": "s1",
      "confidence": "medium"
    }
  },
  "verification": {
    "status": "unverified",
    "last_verified": "2026-08-27"
  }
}
