{
  "schema_version": 1,
  "gtin": "08904149103245",
  "barcode_printed": "8904149103245",
  "barcode_format": "EAN-13",
  "name": "Fhjkgcvkk",
  "countries": [
    "IN"
  ],
  "ingredients_raw": "23",
  "sources": [
    {
      "id": "s1",
      "type": "open_database",
      "url": "https://world.openfoodfacts.org/product/8904149103245",
      "retrieved_at": "2026-09-01",
      "licence": "ODbL-1.0 (database), DbCL-1.0 (contents)"
    }
  ],
  "provenance": {
    "name": {
      "source": "s1",
      "confidence": "medium"
    },
    "ingredients_raw": {
      "source": "s1",
      "confidence": "medium"
    }
  },
  "verification": {
    "status": "unverified",
    "last_verified": "2026-09-01"
  }
}
