{
  "schema_version": 1,
  "gtin": "08901030625381",
  "barcode_printed": "8901030625381",
  "barcode_format": "EAN-13",
  "name": "bru coffee",
  "brand": "bru",
  "category": "coffee",
  "countries": [
    "IN"
  ],
  "nutrition": [
    {
      "basis": "per_100g",
      "values": {
        "protein_g": 0.2,
        "carbohydrate_g": 0.5,
        "sugars_g": 0,
        "fat_g": 0,
        "saturated_fat_g": 0,
        "fibre_g": 0,
        "sodium_mg": 0
      }
    }
  ],
  "sources": [
    {
      "id": "s1",
      "type": "open_database",
      "url": "https://world.openfoodfacts.org/product/8901030625381",
      "retrieved_at": "2026-08-27",
      "licence": "ODbL-1.0 (database), DbCL-1.0 (contents)"
    }
  ],
  "provenance": {
    "name": {
      "source": "s1",
      "confidence": "medium"
    },
    "brand": {
      "source": "s1",
      "confidence": "medium"
    },
    "category": {
      "source": "s1",
      "confidence": "medium"
    },
    "nutrition": {
      "source": "s1",
      "confidence": "medium"
    }
  },
  "verification": {
    "status": "unverified",
    "last_verified": "2026-08-27"
  }
}
