{
  "schema_version": 1,
  "gtin": "08906001721017",
  "barcode_printed": "8906001721017",
  "barcode_format": "EAN-13",
  "name": "Pasteurised Toned Milk Dahi",
  "brand": "paras",
  "category": "yogurt",
  "countries": [
    "IN"
  ],
  "ingredients_raw": "Pasteurised Toned Mik Milk Solids and Active Lactic Culture",
  "sources": [
    {
      "id": "s1",
      "type": "open_database",
      "url": "https://world.openfoodfacts.org/product/8906001721017",
      "retrieved_at": "2026-09-01",
      "licence": "ODbL-1.0 (database), DbCL-1.0 (contents)"
    }
  ],
  "provenance": {
    "name": {
      "source": "s1",
      "confidence": "medium"
    },
    "brand": {
      "source": "s1",
      "confidence": "medium"
    },
    "category": {
      "source": "s1",
      "confidence": "medium"
    },
    "ingredients_raw": {
      "source": "s1",
      "confidence": "medium"
    }
  },
  "verification": {
    "status": "unverified",
    "last_verified": "2026-09-01"
  }
}
