{
  "schema_version": 1,
  "gtin": "08904132980648",
  "barcode_printed": "8904132980648",
  "barcode_format": "EAN-13",
  "name": "Best Farm cashew 100g",
  "countries": [
    "IN"
  ],
  "sources": [
    {
      "id": "s1",
      "type": "open_database",
      "url": "https://world.openfoodfacts.org/product/8904132980648",
      "retrieved_at": "2026-08-27",
      "licence": "ODbL-1.0 (database), DbCL-1.0 (contents)"
    }
  ],
  "provenance": {
    "name": {
      "source": "s1",
      "confidence": "medium"
    }
  },
  "verification": {
    "status": "unverified",
    "last_verified": "2026-08-27"
  }
}
