{
  "schema_version": 1,
  "gtin": "08906161390580",
  "barcode_printed": "8906161390580",
  "barcode_format": "EAN-13",
  "name": "Potato waffers",
  "brand": "let-s-try",
  "category": "chips",
  "countries": [
    "IN"
  ],
  "package": {
    "quantity": {
      "value": 60,
      "unit": "g"
    }
  },
  "ingredients_raw": "Potato, Edible Vegetable oil, groundnut oil, rock salt",
  "sources": [
    {
      "id": "s1",
      "type": "open_database",
      "url": "https://world.openfoodfacts.org/product/8906161390580",
      "retrieved_at": "2026-08-27",
      "licence": "ODbL-1.0 (database), DbCL-1.0 (contents)"
    }
  ],
  "provenance": {
    "name": {
      "source": "s1",
      "confidence": "medium"
    },
    "brand": {
      "source": "s1",
      "confidence": "medium"
    },
    "category": {
      "source": "s1",
      "confidence": "medium"
    },
    "package": {
      "source": "s1",
      "confidence": "medium"
    },
    "ingredients_raw": {
      "source": "s1",
      "confidence": "medium"
    }
  },
  "verification": {
    "status": "unverified",
    "last_verified": "2026-08-27"
  }
}
