{
  "schema_version": 1,
  "gtin": "08906055440568",
  "barcode_printed": "8906055440568",
  "barcode_format": "EAN-13",
  "name": "Organic Peanuts",
  "brand": "organic-tattva",
  "category": "pulses",
  "countries": [
    "IN"
  ],
  "package": {
    "quantity": {
      "value": 500,
      "unit": "g"
    }
  },
  "nutrition": [
    {
      "basis": "per_100g",
      "values": {
        "energy_kcal": 620,
        "protein_g": 25,
        "carbohydrate_g": 17,
        "sugars_g": 4,
        "fat_g": 50,
        "saturated_fat_g": 9,
        "fibre_g": 9,
        "sodium_mg": 5
      }
    }
  ],
  "ingredients_raw": "peanuts",
  "sources": [
    {
      "id": "s1",
      "type": "open_database",
      "url": "https://world.openfoodfacts.org/product/8906055440568",
      "retrieved_at": "2026-08-27",
      "licence": "ODbL-1.0 (database), DbCL-1.0 (contents)"
    }
  ],
  "provenance": {
    "name": {
      "source": "s1",
      "confidence": "medium"
    },
    "brand": {
      "source": "s1",
      "confidence": "medium"
    },
    "category": {
      "source": "s1",
      "confidence": "medium"
    },
    "package": {
      "source": "s1",
      "confidence": "medium"
    },
    "nutrition": {
      "source": "s1",
      "confidence": "medium"
    },
    "ingredients_raw": {
      "source": "s1",
      "confidence": "medium"
    }
  },
  "verification": {
    "status": "unverified",
    "last_verified": "2026-08-27"
  }
}
